<?xml version="1.0" encoding="UTF-8"?>
<!DOCTYPE report SYSTEM "report.dtd">
<report>
  <semester>1</semester>
  <student id="1">
    <name>elena</name>
    <lastname>kout</lastname>
    <completed>10</completed>
    <average>6.5</average>
  </student>
  <student id="2">
    <name>thanos</name>
    <lastname>kouim</lastname>
    <completed>5</completed>
    <average>10</average>
  </student>
  <student id="3">
    <name>stasis</name>
    <lastname>akouim</lastname>
    <completed>5</completed>
    <average>8</average>
  </student>
  <student id="4">
    <name>elisabet</name>
    <lastname>pegia</lastname>
    <completed>8</completed>
    <average>5</average>
  </student>
</report>