<?xml version="1.0" encoding="UTF-8"?>
<!DOCTYPE report SYSTEM "report.dtd">
<report>
  <semester>2</semester>
  <student id="65">
    <name>Ευλαμπία</name>
    <lastname>Κοκκίνου</lastname>
    <completed>4</completed>
  </student>
  <student id="37">
    <name>Έλενα</name>
    <lastname>Κουτούση</lastname>
    <completed>5</completed>
  </student>
  <student id="68">
    <name>Νεφέλη</name>
    <lastname>Παπαδοπούλου</lastname>
    <completed>3</completed>
  </student>
  <student id="6">
    <name>Ζωή</name>
    <lastname>Παπαστάμου</lastname>
    <completed>2</completed>
  </student>
</report>
